Index,sentence,post_title,subreddit,source
1,"I-am tras-o lu sor-sa in timp ce se uita la noi, am terminat, m-a lovit post nut clarity, m-am imbracat in liniste, am fumat juma de cui ramas in scrumiera si dupa am plecat acasa",Experiente sexuale pe care vreti sa le uitati,Men_RO,post
2,"Fizic vorbind eu cred ca sunt OK, dar din nefericire sufar de Autism si ADHD","E cineva aici care a avut prima relatie dupa 25/30 de ani? Daca da, cum v-ati simtit?",Men_RO,post
3,"Ce te ai priponit așa de zici că e capăt de lume cu virginitatea 
și cu nefericirea ta, cu ce ai zis ca ai, autism","E cineva aici care a avut prima relatie dupa 25/30 de ani? Daca da, cum v-ati simtit?",Men_RO,comment
4,"Am 26 de ani si o duc foarte bine de unul singur,nu am chef sa ma incurc cu o gagica si sa imi stric propriul confort si propria bunastare",Ce părere aveți dacă s-ar implementa iarăși taxa de celibat? În Japonia deja se pregătește terenul.,Men_RO,comment
5,Pentru liniste platesc oricat,Ce părere aveți dacă s-ar implementa iarăși taxa de celibat? În Japonia deja se pregătește terenul.,Men_RO,comment
6,"Eu un late bloomer ca sa zic așa,  mi-am inceput viața sexuală la 21 de ani, deci viitoarea mea soție  e singura persoana cu care am întreținut raporturi sexuale, in schimb nu e si invers, ea a avut mult mai mulți parteneri pana la mine(din ce am mai povestit tot ce a experimentat s-a intamplat într-o perioada mai sumbră din viata ei plina de alcool si droguri)",Diferență de parteneri intre noi,Men_RO,post
7,"Din fericire am reușit pana la vârsta asta să ajung la o gândire bună, poate peste medie din multe puncte de vedere si sa constientizez ca nu contează ce zic si cred alții",Diferență de parteneri intre noi,Men_RO,post
8,"Incearca sa accepti chestia asta, nu e vina ei ca ai fost tu late bloomer, fiecare si-a trait viata si trecutul cum a putut si a stiut, iar ea ti-a zis de la inceput",Diferență de parteneri intre noi,Men_RO,comment
9,"Tu ai avut viata ta, ea pe a ei",Diferență de parteneri intre noi,Men_RO,comment
10,"Viata e scurta, fa ce te face fericit",Diferență de parteneri intre noi,Men_RO,comment
11,Viata e scurta si cel mai des regretam lucrurile pe care nu le-am facut decat ce am facut :)),Diferență de parteneri intre noi,Men_RO,comment
12,"Am 165-68 și din fericire n-am dat peste oamenii care ar râde de înălțimea mea în față, dar mă îngrijorează când vine vorba de relații",Cum accepți înălțimea mică?,Men_RO,post
13,Partea buna e ca poti deveni tanchist,Cum accepți înălțimea mică?,Men_RO,comment
14,Dacă m-ar fi văzut Ramsey cu valsam prin bucătărie ar fi vărsat o lacrimă de bucurie,"Am făcut burgeri, din nou.",Men_RO,post
15,Asa se pune viata in ordine,"Am făcut burgeri, din nou.",Men_RO,comment
16,Spunând asta cu buzele țuguiate și aproape țopăind de fericire,Căscați ochii ca să nu beliți... [Varianta nr.2],Men_RO,post
17,Pot sa stabilească o suma pe care o ia ea înapoi sau frumos la tribunal unde judecătorul decide cota parte,Căscați ochii ca să nu beliți... [Varianta nr.2],Men_RO,comment
18,"Situatia e relativ simpla - bunurile dobandite inainte de casatorie raman bunuri proprii, cele dobandite in timpul casatoriei sunt bunuri comune 50-50",Căscați ochii ca să nu beliți... [Varianta nr.2],Men_RO,comment
19,"Si eu am avut o relatie lunga, dar nu am incercat sa am o viata total noua dupa aceea",Divort barbati 30+,Men_RO,post
20,Zici ca si-a schimbat viata total,Divort barbati 30+,Men_RO,comment
21,"Si mie sincer a asta imi suna, a face absolut tot posibilul sa isi refaca viata, dar asta nu-l face pregatit sa se implice",Divort barbati 30+,Men_RO,comment
22,"De maxim 2-3 saptamani, am dat peste o fata care este lipicioasa cu mine, pur si simplu, nu s-a uitat nimeni in viata mea cu asemenea ochi la mine",Barbatii si afectiunea,Men_RO,comment
23,"am ramas 10 secunde in apel in liniste amandoi apoi m-a atentionat ca daca insist, primesc amenda
Am sunat din nou sperand sa gasesc pe cineva mai intelegator, pana la urma vorbim de o ilegalitate si ei sunt obligati macar sa verifice",Apel la 112 cu consecinte fara motiv,Men_RO,post
24,"Sa scap de anxietate pe viata, sa nu mai am povara asta zilnica care ma opreste din a face toate planurile",Ce cadou ați vrea să primiți?,Men_RO,comment
25,"liniste, lucrez la asta, dar mai dureaza",Ce cadou ați vrea să primiți?,Men_RO,comment
26,Tu proceseaza acolo informatie si vezi-ti de viata,Trăim intr o simulare?,Men_RO,comment
27,"In primul rand, acesta sper sa fie un post pozitiv si sa mai iesim putin din depresie pe partea a ceea ce doare cel mai tare in viata unui barbat, sexul nefacut","Mai pozitivi, ca sex-ul nu este totul",Men_RO,post
28,La facultate am reusit sa imi fac prieteni si sa mai ies din aceasta bula care imi rupea in doua mintea si a fost ceea ce a trebuit pentru a scapa de sentimentul de sex nefacut (+ am reusit sa renunt la masturbate poate cea mai mare perioada din viata mea si anume 4 luni de cand am descoperit aceasta stiinta),"Mai pozitivi, ca sex-ul nu este totul",Men_RO,post
29,"In acea atmosfera de IQ sub 50 am simtit cum cativa neuroni doresc sa imi reaminteasca asta si sa ma scoata din acea fericire dandu mi idei, stergand pe jos rasul meu pentru cateva secunde si impingandu-ma catre IQ 200","Mai pozitivi, ca sex-ul nu este totul",Men_RO,post
30,Pentru 15-30 de minute de fericire care aceasta fericire este practic o substanta pe care creierul o fuzioneaza,"Mai pozitivi, ca sex-ul nu este totul",Men_RO,post
31,"Analizand aceste lucruri pot spune ca nu, in acelasi timp ma simt ca un calator in timp ca restul oamenilor, practic imi traiesc viata fara un scop (faptul ca am un hobby-uri, nu reprezinta un scop), in 2024 scopul este denumit ca si ""am facut un copil"" sau ""sunt intr-o relatie, pot sa am grija de cineva"" dar oare asta inseamna un scop","Mai pozitivi, ca sex-ul nu este totul",Men_RO,post
32,"pot spune ca asta sunt, un om care munceste, un om care prefera sa fie euforic din orice cand are cu cine, prefer sa imi folosesc neuronii doar in scop profesional, in timpul liber sa ma comport de parca acum invat sa numar, am un loc al meu, nu simt presiunea datoriilor, nu simt presiunea bolilor (daca are logica), teoretic ma simt bine, poate delirez dar, cred ca singurul lucru care imi lipseste in viata este o relatie, in rest pot spune ca le-am facut pe toate, dar again, se merita sa ating 100% cu riscul de a ajuns la 0%","Mai pozitivi, ca sex-ul nu este totul",Men_RO,post
33,ca o viata aveti,"Mai pozitivi, ca sex-ul nu este totul",Men_RO,comment
34,Absolut orice in viata vine si cu riscuri,"Mai pozitivi, ca sex-ul nu este totul",Men_RO,comment
35,E viata ta,"Mai pozitivi, ca sex-ul nu este totul",Men_RO,comment
36,Fiecare decide ce e important in viata pentru el si cum vrea sa si-o traiasca,"Mai pozitivi, ca sex-ul nu este totul",Men_RO,comment
37,Gandeste-te bine de tot ce iti doresti in viata asta si mergi in directia aia,"Mai pozitivi, ca sex-ul nu este totul",Men_RO,comment
38,"Insa pe langa toate astea am avut fericire, dragoste, motivatie, comfort, companie, comunicare etc","Mai pozitivi, ca sex-ul nu este totul",Men_RO,comment
39,"Datorita ei, sunt o persoana mai buna, si datorita mie, si ea e o persoana mai buna","Mai pozitivi, ca sex-ul nu este totul",Men_RO,comment
40,Avem obiective comune si impartim viata cu bune si cu rele,"Mai pozitivi, ca sex-ul nu este totul",Men_RO,comment
41,Avem si un baietel de 6 luni care aduce extrem de multa bucurie in vietile noastre,"Mai pozitivi, ca sex-ul nu este totul",Men_RO,comment
42,"Fara sex nu as fi luat niste decizii majore din viata mea, care m-au format ca om","Mai pozitivi, ca sex-ul nu este totul",Men_RO,comment
43,Sexul e viata,"Mai pozitivi, ca sex-ul nu este totul",Men_RO,comment
44,Analizeaza relatiile sau tentativele romantice din viata ta,"Mai pozitivi, ca sex-ul nu este totul",Men_RO,comment
45,"exista o regula care se aplica banilor, dar se aplica si sexului: banii nu sunt cel mai important lucru din viata cand ii ai, dar cand nu ii ai devin brusc cel mai important lucru","Mai pozitivi, ca sex-ul nu este totul",Men_RO,comment
46,"Recent am si inceput sa vorbesc cu o fata si pare super misto, vorbim mult, flirtam, ma sustine in cam tot ce fac (intorc si eu favorul, stati linistiti), avem destule in comun, valori morale comune, si ne cam dorim acelasi lucru de la viata",Cum scap de frica de a fi inselat?,Men_RO,post
47,"Mai mult pe net, ce-i drept, cam 90%, dar aud si in viata reala de casnicii si relatii stricate de colegi de la munca sau alte situatii de genul",Cum scap de frica de a fi inselat?,Men_RO,post
48,"Asta e bucurie, mai ales pe canicula asta, cine nu își dorește mai mult loc în pat",Cum scap de frica de a fi inselat?,Men_RO,comment
49,"De ce sa traiesti cu drobul de sare deasupra capului, iti strici linistea si nu rezolvi nimic",Cum scap de frica de a fi inselat?,Men_RO,comment
50,"Si daca te inseala, aia e, nu esti nici primul, nici ultimul, dar nu o sa ai o viata linistita si senina daca in loc sa vezi cerul, tu cauti intai norii de furtuna",Cum scap de frica de a fi inselat?,Men_RO,comment
51,"M-a refuzat, dar de data asta nu a început să spună la toată lumea așa că nu am ajuns bătaia de joc și în facultate din fericire",M-am scârbit de viața asta și nu mai văd rostul în ea de ani buni,Men_RO,post
52,"Dar pana atunci trebuie sa vezi viata si din perspectiva ""nu am iubita""",M-am scârbit de viața asta și nu mai văd rostul în ea de ani buni,Men_RO,comment
53,"Sper sa continui cu sala si sa iti mai gasesti si alte hobby-uri, stiu ce inseamna singuratatea dar adevarul e ca o sa fie unele momente in viata in care chiar suntem singuri si trebuie sa acceptam asta",M-am scârbit de viața asta și nu mai văd rostul în ea de ani buni,Men_RO,comment
54,"Eu zic sa incerci sa te debarasezi pt un an macar de obsesia de ati gasi iubita si sa te redescoperi pe tine, sa iti dai timp in ati gasi starea ta de fericire care sa iti permita sa fii multumit de persoana ta",M-am scârbit de viața asta și nu mai văd rostul în ea de ani buni,Men_RO,comment
55,"Chiar sper ca intr-o zi sa te poti bucura de viata ca meriti cel mai mult asta, fie cu o fata langa tine sau nu",M-am scârbit de viața asta și nu mai văd rostul în ea de ani buni,Men_RO,comment
56,"Long story short am crescut cu un părinte narcissist si celalat anxios, abuzuri sexuale, am fost abuzata fizic si psihic de la 6 ani pana la 25, de membrii ai familiei, colegi de scoala, straini consider ca situația mea a fost mai buna decât a ta, dacă am putea masura nivelul de trauma traita",M-am scârbit de viața asta și nu mai văd rostul în ea de ani buni,Men_RO,comment
